{
  "$schema": "https://json-schema.org/draft/2020-12/schema",
  "type": "array",
  "items": {
    "type": "object",
    "properties": {
      "name": {
        "type": "string",
        "description": "Media image entity name (default to filename)"
      },
      "file": {
        "type": "string",
        "description": "Banner featured image url"
      },
      "uuid": {
        "type": "string",
        "description": "UUID for image"
      },
      "alt": {
        "type": "string",
        "description": "Alt tag"
      }
    },
    "required": ["name", "file", "uuid", "alt"]
  }
}
