[
  {
    "uuid": "f352fb5f-5319-4a09-a039-6b7080b31443",
    "name": "D10 launch.png",
    "file": "https://www.civictheme.io/sites/default/files/images/2022-10/D10%20launch.png",
    "alt": "Test alt text for thumbnail"
  },
  {
    "uuid": "7bed7c3c-ebab-44aa-b19e-0e164ab81d10",
    "name": "test4.png",
    "file": "https://www.civictheme.io/sites/default/files/images/2022-05/Adopt%20-%20The%20DIY%20approach.png",
    "alt": "Test alt text for thumbnail"
  },
  {
    "uuid": "427186ad-c561-4441-9951-28399d8a4923",
    "name": "demo_banner-background.png",
    "file": "https://www.civictheme.io/sites/default/files/demo_banner-background.png",
    "alt": "Test background"
  }
]
