[
    {
        "name": "\"\"",
        "file": "https://www.govcms.gov.au/sites/default/files/styles/natural/public/2019-10/why-govcms-icon.png?itok=s_QSggn-",
        "uuid": "4c87b5c8-ab89-3dd4-8c06-77b7ebfc0b03",
        "alt": "\"\""
    },
    {
        "name": "\"\"",
        "file": "https://www.govcms.gov.au/sites/default/files/styles/natural/public/2019-10/your-govcms-journey-photo.jpg?itok=pajRr_Rv",
        "uuid": "67b62162-8044-346b-8e2b-09d383e0d662",
        "alt": "\"\""
    },
    {
        "name": "\"\"",
        "file": "https://www.govcms.gov.au/sites/default/files/styles/natural/public/2019-10/support-icon.png?itok=Zg6aTwiQ",
        "uuid": "0e64e2c9-9f08-3d70-8f4f-f4f4bc4a6695",
        "alt": "\"\""
    },
    {
        "name": "Woman helping support another woman on a laptop",
        "file": "https://www.govcms.gov.au/sites/default/files/styles/natural/public/2019-10/support-photo-1.jpg?itok=EJWkbvGU",
        "uuid": "69674331-7c50-334b-b2a6-913854b05d40",
        "alt": "Woman helping support another woman on a laptop"
    }
]
